question,analysis,model_type,training_data,test_data,endpoint,metric,result,interpretation,limitation,evidence_summary,evidence_score
Q1,p53 ODE S46 AUC -> TCGA survival,mechanistic ODE,given p53 ODE template; not fitted to TCGA survival,TCGA-BRCA patients,overall survival,Cox HR per 1 SD; age-adjusted HR,"HR 0.85, p=0.038; age-adjusted HR 0.84, p=0.027",Modest prognostic association: higher p53 S46 AUC was associated with lower survival hazard.,TCGA survival is prognostic and does not directly measure doxorubicin response.,modest positive evidence,1
Q2,p53 ODE S46 AUC -> PRISM doxorubicin sensitivity,mechanistic ODE,given p53 ODE template; not fitted to PRISM response,PRISM/DepMap breast cancer cell lines,doxorubicin sensitivity,Spearman and Pearson correlation,"Spearman r=0.04, p=0.838; Pearson r=0.01, p=0.961",No meaningful association with PRISM doxorubicin sensitivity.,Only 26 breast cancer cell lines; static baseline expression is an imperfect proxy for dynamic drug response.,weak or absent evidence,0
Q3,"PRISM elastic-net signature -> PRISM doxorubicin sensitivity, in-sample",elastic-net regression,PRISM/DepMap breast cancer cell lines,same PRISM/DepMap cell lines,doxorubicin sensitivity,"apparent R2, RMSE, Spearman correlation","R2=0.44, RMSE=1.10, Spearman r=0.76, p=6.66e-06","Moderate apparent fit, but this is optimistic because the same 26 lines were used for fitting and assessment.",In-sample performance does not estimate generalisation.,apparent fit only,1
Q3,"PRISM elastic-net signature -> PRISM doxorubicin sensitivity, LOOCV",elastic-net regression,"PRISM/DepMap breast cancer cell lines, leave-one-out folds",held-out PRISM/DepMap cell line in each fold,doxorubicin sensitivity,"LOOCV R2, RMSE, Spearman correlation","LOOCV R2=-0.83, RMSE=1.99, Spearman r=-0.22, p=0.279","Poor cross-validated performance, suggesting weak generalisation in this small cell-line set.",LOOCV is unstable with n=26 but is more realistic than apparent fit.,poor generalisation,-1
Q3,PRISM elastic-net signature transferred to TCGA survival,elastic-net regression transfer,PRISM/DepMap breast cancer cell lines,TCGA-BRCA patients,overall survival,Cox HR,"HR=0.95, p=0.603",The cell-line doxorubicin signature did not transfer to TCGA survival.,Patient survival is not a direct drug-response endpoint.,weak or absent evidence,0
Q4,TCGA Cox gene score -> TCGA survival,Cox regression,TCGA-BRCA patients,same TCGA-BRCA patients,overall survival,Cox HR,"HR=2.72, p=9.5e-08",Strong within-domain prognostic signal inside TCGA-BRCA.,"This is an apparent within-domain survival score, not an external validation.",strong within-domain evidence,2
Q4,TCGA Cox gene score transferred to PRISM doxorubicin sensitivity,Cox regression transfer,TCGA-BRCA patients,PRISM/DepMap breast cancer cell lines,doxorubicin sensitivity,Spearman correlation,"Spearman r=0.01, p=0.975",The patient survival score did not transfer to PRISM doxorubicin sensitivity.,Cell-line drug sensitivity and patient prognosis are biologically related but not interchangeable.,weak or absent evidence,0
